<?xml version='1.0' encoding='UTF-8' ?>
<!DOCTYPE sd7hooks SYSTEM "http://7d7.almlys.org/spec/draft/sd7Hooks.dtd">
<sd7hooks>

	<!-- Define Basic System Key bindings -->
	<controller name='basicInput'
    bind='sd7.system.basicInput.MyBasicInputHandler'
    autostart='true' />

    <!-- Stats window -->
    <controller name = 'Stats'
    bind = 'sd7.system.stats.Stats'
    autostart = 'true' >
        <param name = 'visible'>true</param>
    </controller>

	<!-- Loads the layout defined in the parameter	-->
	<controller name='gui' bind='sd7.logic.gui.GUI' autostart='false' >
		<param name='layout'>stats.layout</param>
	</controller>
	
    <!-- Script that set ups the Camera -->
    <controller name = 'Cam'
    bind = 'sd7.logic.camera.Camera'
    autostart = 'true' />

	<controller name='startup' bind='sd7.system.startup.StartupHandler' />
	
	<controller name='chatapp' bind='sd7.logic.chatapp.ChatApp' autostart='true' />

	
</sd7hooks>